Affiliation,Codon usage ,Collection name,Database links,Detailed description,Email Address,Genbank file,Name (first and last),ORCID ,Other tags,Part type,Project,Safety information,Timestamp
BioBricks Foundation,E.coli,rrnB T1 terminator,,This part is a test case to see if the software associated with submissions is working properly,koeng101@gmail.com,https://drive.google.com/open?id=1iaK2uiwCGul3ko37u7lkaFNlMVZK0S9L,Keoni Gandall,https://orcid.org/0000-0003-3995-6416,#FreeGenes,terminator,A test case for this form,A completely safe part,3/5/2018 11:23:09
BioBricks Foundation,B.subtilis,AgeIM,http://rebase.neb.com/rebase/enz/AgeI.html,AgeIM methyltransferase. Targets ACCGGT.,koeng101@gmail.com,https://drive.google.com/open?id=1Ae35nvgEX5cCK2yciTvQMRqar2eubfs6,Keoni Gandall,https://orcid.org/0000-0003-3995-6416,#testing,cds,Testing dif,,3/5/2018 15:33:33
BioBricks Foundation,E.coli,Single GFP,https://www.uniprot.org/uniprot/P42212,"sfGFP to test ""keyword"" and ""definition"" field in GenBank uploads.",koeng101@gmail.com,https://drive.google.com/open?id=1ZiHoWjCcG5XiSHFQ1wYqlhMN2H5sKVSn,Keoni Gandall,https://orcid.org/0000-0003-3995-6416,#glow,cds,Testing set of submissions,Safe protein,3/6/2018 12:07:30
Independent Researcher,4100,Interetesting genes for Nicotiana benthamiana,,This is a collection contains a dinoflagellate  luciferase catalytic domain and several chlorophyll degradation genes.,coreyhowe99@gmail.com,https://drive.google.com/open?id=1nGk03sUncRv3FdN5UPPAUgKxC4-n2dgT,Corey Howe,,#glowingplants,cds,Corey Howe miscellaneous,,3/7/2018 12:00:40
Stanford University,H.sapiens,Alzheimer's associated proteins,,A collection of poorly understood Alzheimer's associated proteins.,alvinhuang@stanford.edu,https://drive.google.com/open?id=1L1cdoJRl025O0fVgGSqQR6E72CmzRJo-,Alvin Huang,,,cds,Alvin Huang interesting genes,,3/7/2018 12:07:53
NASA Ames,B.subtilis,Aminobenzoates biosynthesis,,Variety of aminobenzote alleles.,nils.j.averesch@nasa.gov,https://drive.google.com/open?id=1pSppPSzrwmVZk-Zzp8wqdy1RPwlcyT0g,Nils Averesch,https://orcid.org/0000-0002-6389-2646,#space,cds,Bacillus subtilis aminobenzoates biosynthesis,,3/7/2018 12:37:19
Johns Hopkins University,E.coli,Sapovirus RdRp,,RdRp E. coli optimized from Sapovirus,joshua@jhu.edu,https://drive.google.com/open?id=1bYJoK_hA1FIx4Me-MpZ7umLedJ707LrW,Joshua Yang,,,cds,RdRp E. coli optimized from Sapovirus,,3/7/2018 12:45:57
Stanford University,E.coli,K1-5 RNA polymerase,,The K1-5 RNA polymease. Orthogonal from T7 RNA polymerase. Contributed to public domain.,endy@stanford.edu,https://drive.google.com/open?id=1iBJNcdu1OztIovba9-sZql3A6_M5lIL5,Drew Endy,https://orcid.org/0000-0001-6952-8098,,cds,Build-a-cell meeting 2 test run,,3/7/2018 12:53:17
